Title,Image URL
​Prieš šventes – pokyčiai ne tik parduotuvėse ar TV ekrane: Kalėdos Lietuvoje bus rekordinės,https://media.lrytas.lt/images/2024/11/21/152425071-ba482f1f-80ef-4829-a3b6-9d0f811c696b.jpg
Vidmantas Janulevičius. Kad tik nenusibaustume patys: „Estai jau paeksperimentavo“,https://media.lrytas.lt/images/2024/11/25/104425807-ca39e70b-0d74-4929-b6de-f875a05a3ec7.jpg
A. Pikšrytė: D. Trumpo pergalę jau dabar vadina „ekologine katastrofa“,https://media.lrytas.lt/images/2024/11/25/143808533-722927ea-fc93-4ab1-b89b-cab4099ec957.jpg
Haroldas Nausėda. Stabilios elektros kainos verslui ateityje: mitas ar neišnaudota galimybė?,https://media.lrytas.lt/images/2024/11/25/143528464-a50d90f4-e1c4-4a12-a91a-d0fce04c528e.jpg
Kasčiūnas reassures people after Vilnius air crash: no signs of a terrorist act so far,https://media.lrytas.lt/images/2024/11/25/090904625-ebd6f68c-0eb2-42a6-bb30-d7b72915146c.jpg
SBA's Vėjo Miestelis (Wind Town) project raises additional EUR 1.8 million: the second tranche of the bond issue has been successfully placed,https://media.lrytas.lt/images/2024/11/25/101244652-5239c346-9368-4e09-884f-11f70e1823c6.jpg
Paulauskis is appointed as Chairman of the Board of Robotex,https://media.lrytas.lt/images/2024/11/22/091152564-af648d68-2cc4-4704-bb2d-1668890d1615.jpg
First names of ministerial candidates after Paluckas meet with Nausėda,https://media.lrytas.lt/images/2024/11/25/163015688-51c3844b-950b-4aae-a4f1-d9792f9da801.jpg
"Karbauskis addresses the Peasants in a letter: admits mistakes regarding Vėgėlė, criticises Blinkevičiūtė and Skvernelis",https://media.lrytas.lt/images/2024/11/25/115145009-e89fc4af-05b3-4210-a7d4-bb0273cd8dd3.jpg
